view_count,answer_count,Query,Intent
40,0,Need help creating a button which displays an image when pressed,
40,0,Indentation problems when pasting in VS code (python),
40,0,Keeping data type when saving pandas df to machine,
40,0,Worker was sent code 139! running Gunicorn + Chroma,
40,0,PyICU import halts Python interpreter on Windows 11 23H2,
40,0,Python 3.12 + django 5.1: debug doesn&#39;t work in VSCode,
40,0,cv2.imshow() is disabled in Google Colab,
40,0,views have lost access to models in Django,
40,0,PCA on transformed point cloud : eigenvectors randomly change orientation,
40,0,How to list all URLs accessed by AWS Glue when reading from BigQuery?,
40,0,Why does MP-PCA denoising with DIPY cause black regions to appear in my GRE MRI data?,
40,0,Special Characters needing two backspaces to get erased on VS Code,
40,0,Google GEMINI API migration response,
40,0,RSS Memory and Virtual Memory do not decrease even after killing a playwright instance and creating a completely new one,
40,0,How to Calculate the Signature for Forge of Empires HTTP Requests?,
40,0,Selenium chromium browser sometimes not opens a page,
40,0,Download button click with Selenium isn’t triggering Excel file download,
40,0,Pyinstaller compiles eel but does not find the sources,
40,0,How can I let a Worker thread receive signals?,
40,0,Python run own module in async shell,
40,0,How to generate an acceleration spectrogram using Plotly from InfluxDB data,
40,0,Why does the Telegram client connection drop unexpectedly during execution in Telethon?,
40,0,SAS if-then Statement to Python Vectorized Approach - My Values are Not Matching Up,
40,0,Column Values are missing when being printed,
40,0,Anti Captcha eror: ERROR_FAILED_LOADING_WIDGET (PYTHON),
40,0,return 401 from lambda non-proxy api gateway and return headers,
40,0,Why does \t produce different numbers of spaces in Python output?,
40,0,Streamlit application deployment issue,
40,0,How do I get responses from Spotify API after status code 304?,
40,0,authorize.net authOnlyTransaction immediately charges customer&#39;s card,
40,0,Best practice for sharing resource in a Python module?,
40,0,Bad request version/syntax/type when executing POST request to flask,
40,0,Scrapy Playwright scraping all table data after clicking &quot;Show More&quot; button,
40,0,What type of dependency management does `pip` do?,
40,0,How to replicate statmodels&#39; ARIMA fittedvalues for a MA(1)? (Python package),
40,0,How can I encode my webcam stream towards a remote desktop service?,
40,0,Doxygen support for python decorators,
40,0,Python frequency analysis - AIC of infinity for several distributions despite a good fit,
40,0,Pylint is ignoring disable flag,
39,2,i keep getting this error: ctypes.ArgumentError: argument 1: TypeError: Don&#39;t know how to convert parameter 1,
39,2,How to fit the font-awesome icon with text in the nicegui mermaid graph nodes,
39,2,Running Django tests ends with MigrationSchemaMissing exception,
39,2,How to route from Flask to React with specific path,
39,1,How to update a CSV file based on certain condition to get the new value only if that condition is true?,
39,1,Pyside6 - Change svg icon color dynamically,
39,1,pip install fails due to hash mismatch,
39,1,Error installing dependencies from requirements.txt when setting up YOLOv10,
39,1,PySpark UDF mapping is returning empty columns,
39,1,Dynamic call to attribute&#39;s method ends up to calling it on wrong instance (after reseting attribute),
39,1,&quot;ModuleNotFoundError: No module named &#39;ESMF&#39;&quot; when importing xesmf installed via conda,
39,1,polars - no attribute &#39;extract_many&#39;,
39,1,Yolo v11 obj detection custom inference gives totally different results than yolo cli predict,
39,1,Cannot read files list from a specific channel from slack using Python,
39,1,How can I save the list of packages used after running &quot;uv run --with REQUIRED_PACKAGE MYSCRIPT.py&quot;?,
39,1,Conda Installed Scipy v1.15.2 Does not contain Gaussian function,
39,1,Python 3 on windows ARM loading pandas,
39,1,sketch partial regression chart using dash,
39,1,pyhton TTKBootstrap Menu - style not applied,
39,1,Saving subplots in matplotlib as separate images,
39,1,How to find all references of a pytest fixture in vscode?,
39,1,for planets in Planet: TypeError: &#39;type&#39; object is not iterable,
39,1,Visualise colour gradient based on histogram,
39,1,Trying to plot a picewise-defined function in Python,
39,1,Convert a time stamp to seconds from an epoch,
39,1,How to disable robot framework automatically logging KubeLibrary response to DEBUG in my python keyword?,
39,1,I want to display three identical QLabel widgets in a QGridLayout,
39,1,How to add function tools in the haystack pipeline?,
39,1,"Creating a child table record, when a new parent table record is created",
39,1,How can I create a closed loop curve in Manim?,
39,1,Update datetime field in bulk save json object Python Django,
39,1,Heatmap of dataset with 3 1-dimensional arrays?,
39,1,Tkinter Treeview rows inserted but not displaying — values confirmed via .item() and .get_children(),
39,1,I want to be able to send the file uploaded by pressing &quot;Enter&quot; and not a send button in streamlit,
39,1,How do I get VSCode Intellisense to work with my python class factory method?,
39,1,How to overpass test case on exercise in MOOC.fi?,
39,1,How to include wingdings 3 characters in a matplotlib data table?,
39,1,Complex Recursive Pydantic class initialization: how to have native Pydantic type checking with custom constructors,
39,1,How can i make my code work for all users who download it,
39,1,PyMongo - Group by year based on subdocument date,
39,1,Read content of Excel with multiple sheets with pandas and append new one sheet,
39,1,Nested parallelism with GridSearchCV causes infinite hang,
39,0,Polars read memory usage issue,
39,0,why my EC2 instance is not recognizing my app?,
39,0,The docling_core library (with smoldocling) fails to export to markdown,
39,0,Can I somehow import/use lists from files made by code in python?,
39,0,Why do I get this error and how to fix it?,
39,0,Can&#39;t figure out customtkinter favicon,
39,0,"ValueError: numpy.dtype size changed, may indicate binary incompatibility. Expected 96 from C header, got 88 from PyObject tensorflowbhuissue. Using",
39,0,BTS algorithm for finding genres and homogeneity sequences,
39,0,How to dynamically create a Prefect deployment from a Git-sourced flow within a FastAPI endpoint?,
39,0,"Using pytest and mongoengine, data is created in the main database instead of a test one",
39,0,Django Broken Pipe Error during Form Submission,
39,0,How to covert pytorch to rknn?,
39,0,Can older spaCy models be ported to future spaCy versions?,
39,0,Trying to do discord auth without getting &quot;CSRF Warning! State not equal in request and response.&quot;,
39,0,"Pyasn1 enumerated type encodes as hex, how do I get decimal",
39,0,Use custom authentication headers to access vector tiles in QGIS plugin,
39,0,Hide Robot Framework source code in Jenkins,
39,0,(NODRIVER) Possible Websocket Error or is it Me?,
39,0,"Deepfilter example python code in Colab gives error - TypeError: argument &#39;input&#39;: &#39;ndarray&#39; object cannot be converted to &#39;PyArray&lt;T, D&gt;&#39;",
39,0,PyQtGraph ROI Mouse Events Not Working Inside QGraphicsProxyWidget,
39,0,How to correctly read and process Kinesis Video Streams fragments?,
39,0,Unblock file programmatically that is created via win32com.client in Python on Windows,
39,0,Intermittent server error in Django after upgrading to MySQL 8,
39,0,Using TableTransformer in Standalone Mode Without Hugging Face Hub Access,
39,0,Can a Python value be annotated with its type without assigning it to a variable?,
39,0,Type coercion stops working after an invalid input in `pandera`,
39,0,Pythonnet (.Net in Python): Failed to initialize Python.Runtime dll,
39,0,Recursively Extracting Nested Archive Files,
38,2,Turning Letter sized pdfs into B size,
38,2,Selenium driver.get(url) does not open the URL,
38,2,how can i fix a problem regarding problem regarding &#39;L1Dist.call()&#39;,
38,2,ssh not accepting access with keygen keys,
38,1,Can&#39;t set Python version when running rust-analyzer and PyO3 on WSL,
38,1,Converting my Jupyter Notebooks into Pycharm,
38,1,Locate link that is not an anchor and does not have unique identifiers other than text,
38,1,Unable To Interect with element in div || Selenium,
38,1,Why does IDLE not let me add pip packages on MACos?,
38,1,multidimensional coordinate transform with xarray,
38,1,duplicate removal from grouped and merged data frame fails generating duplicates in final JSON,
38,1,Process level variable in celery,
38,1,Pyspark SQL Server via Linux with IntegratedSecurity using JDBC,
38,1,I can&#39;t see the custom button i created in the header of the list in my module in odoo18,
38,1,Using logical operators in pytest expected results,
38,1,Python Pandas Interpolate nan columns with respect to the column values,
38,1,How to return combobox item to main window when item is selected,
38,1,Generate RTDB key without creating node,
38,1,Overriding Collectstatic and Manifestic file storage,
38,1,Combine dataframes fuzzy matching on time,
38,1,What&#39;s `_distutils_hack.DistutilsMetaFinder` in `sys.meta_path`?,
38,1,How to write data to a specific fd using Python Pwntools,
38,1,How to Write Key-Value Pairs to a Cloudflare KV Database?,
38,1,Loguru timed rotation keeps creating log files on every application startup,
38,1,OpenCV error when trying to capture frames using a Pyrealsense camera,
38,1,Exploring XMP tags,
38,1,Why does changing one variable that was assigned from a different variable change the variable it was assigned from?,
38,1,Phyton. ttk resize photo in frame with grid,
38,1,Is there some correlation between numpy parent generator seed and its child streams?,
38,1,Plotly express histogram custom bin size,
38,1,How to read metadata information from a file using SMB Protocol?,
38,1,How to use multiple database connections in Django TestCase,
38,1,dynamically finding SMTP Server using Email Address,
38,1,Azure AD Authentication with Django on AWS ALB: Redirect URI problem,
38,1,I can`t find request URL with JSON information while web scraping,
38,1,How can I test that a method of a class was passed as a parameter to a mocked method,
38,1,Chrome Native Messaging Host in Python: Pipenv Not Recognized and Flask App Fails to Run,
38,1,ServiceM8 API Email Sent but Not Appearing in Job Diary,
38,1,How can i mock user input in csv python,
38,1,loading a dataset with datasets.load_dataset is hanging,
38,1,Unable to read output from interactive script in python subprocess.Popen,
38,1,Pass value from one Django template to other,
38,1,Give each hvplot box plot a different colour from default colour cycle,
38,1,External button code to get carousel image attribute,
38,1,Visual Studio code - python- window open the close immediately,
38,1,TUI Python program using the Blessed module only displays correctly in URXVT terminal emulator,
38,1,Why does importlib.resources read_text raise UnicodeDecodeError on Windows but not mac and RPi?,
38,0,Running a script from /opt/ is failing with Docker mounts,
38,0,Error calling initializeNative: exception: access violation reading 0x0000000000000068,
38,0,Subclassing Pandas DataFrame to obtain column names autocompletion in IDE,
38,0,django image cropping error : &#39;ImageField&#39; object has no attribute &#39;image_field&#39;,
38,0,Can you explain values of imgIdx and trainIdx in this example of cv.match?,
38,0,MDDataTable not displaying new Row after adding to it,
38,0,Check validity of interdependent arguments at init,
38,0,error building in terminal in pyhton language,
38,0,"Pylance: &quot;Variable not allowed in type expression&quot; for torch.Tensor return type with from __future__ import annotations (Python 3.12, PyTorch 2.5)",
38,0,PyTorch High Train Loss and Test Loss,
38,0,RuntimeError: mat1 and mat2 shapes cannot be multiplied when using gradcam,
38,0,ImportError: undefined symbol: __powf_finite when importing pyflex extension built via SoftGym/PyFlex,
38,0,onnxruntime pakage missing when using silero-vad,
38,0,Can&#39;t control what variable to dodge on using so.dodge,
38,0,re.search() raises recursion depth error when in thread,
38,0,UnicodeDecodeError: &#39;utf-8&#39; codec can&#39;t decode byte 0xf3 in Django connection with PostgreSQL in Docker,
38,0,avoiding Python overhead in solve_ivp LSODA,
38,0,Function app and powerbi - trigger function from powerbi,
38,0,I2C Slave respond to registry read on Raspberry Pi with Python using pigpio package,
38,0,Calculating a step in a direction of a vector,
38,0,d2l #@save is not working in jupyter notebook,
38,0,How to handle TextFSM errors when using Netmiko to parse output?,
38,0,SqlAlchemy polymorphic with Pydantic TypeAdapter,
38,0,I am working with AIS data in python and i have a problem,
38,0,create unittest for a function that use API request to google cloud logging API,
38,0,Empty Jaeger UI service when sending OTLP traces from fluentBit,
38,0,How do I scale a plot in matplotlib such that the tick marks are precisely 1 inch?,
38,0,Request is still present after clearing with request.clear(),
38,0,Rotate TimedRotatingFileHandler on first calendar day of each month,
38,0,Launch only one background task with multiple Gunicorn workers,
37,2,YOLOv8 RuntimeError: “could not create a primitive” on CPU using PyTorch,
37,2,Selenium Python scrolling dynamic table,
37,1,Iterate over an object that is not an iterator,
37,1,remove ultralytics dependency while loading yolo models,
37,1,Configuring external user-defined module for multiple scripts in python,
37,1,Issues with using subprocess.run for a Jupyter Notebook python file,
37,1,python -v results zsh: command not found: python MacOS Sequoia 15.5 Beta,
37,1,Sqlalchemy and psycopg2: pandas.read_sql_query &quot;dict is not a sequence&quot; error with param substitution,
37,1,Firebase admin taking an infinite time to work,
37,1,Can tree-sitter be used on a QsciLexerCustom in PyQt?,
37,1,Python Asyncio: How to ensure async jobs are executed sequentially from requests,
37,1,Concatenate two Polars string columns or a fixed string to a column,
37,1,Apicurio Schema Registry 3.0.7 - unable to update multiple versions of schema for artifactId,
37,1,Python running probit model: len() of unsized object,
37,1,Doxygen docstring displayable in vscode,
37,1,Nixos - Flask - ModuleNotFoundError,
37,1,How to make a proper code injection statement for a simulation?,
37,1,Error (Py4JJavaError) running pyspark notebook in VSC,
37,1,How to implement images relationship with Abstract model in Django?,
37,1,"How to control the mini-batch size of LazyFrame.map_batches(func, streamable=True).collect(engine=&quot;streaming&quot;)",
37,1,Sending a discord message without needing to have any input in discord,
37,1,Need help scraping FAA N Number database as I can&#39;t seem to communicate with the url,
37,1,How to flatten a mapping constructed from a tagged scalar using ruamel.yaml,
37,1,Get the real python package names,
37,1,Unable to recreate python wand composite command in wand which works in imagemagick composite,
37,1,How to get the path to webelement from shadow DOM for further use in Selenium/Playwright Python auto-tests?,
37,1,How can I initialize a Zarr file that is larger than available memory?,
37,1,How scaling matrix is calculated on itk-snap?,
37,1,"filtering reopened workitems in azure devops, using reporting revisions api",
37,1,How to display a dash leaflet colorbar horizontally?,
37,1,dill.load_session() causes `UnpicklingError: pickle data was truncated` even though dill.dump_session() pickled perfectly fine,
37,1,WhatsApp API Broadcast with Celery - Unable to Reach 1K Throughput Limit,
37,0,Getting ParserError for &quot;usecols&quot; of pandas.read_excel,
37,0,How to using python and Flux.1 make a face swap,
37,0,Detecting Corneal Reflection in EYE medical images,
37,0,Control already opened chrome browser using python,
37,0,"Despite tensorflow.compat.v1, still receiving deprecation and versioning errors",
37,0,Using a folder named collections where I defined my own modules causes ModuleNotFoundError,
37,0,Why does pip install return an HTTPS connection error?,
37,0,I&#39;m trying to use the browser-cookie3 Python package to extract cookies from Chrome using the following code:,
37,0,How to modify the metadata creation date of a file through Python?,
37,0,How to fix Pycharm code inspection giving false positives with qtpy?,
37,0,Identify existence of tables in BigQuery,
37,0,gdal_array can&#39;t be imported in Python-GDAL,
37,0,"I can run an RPA exe by going to the server directory and double clicking it, but get an error using a command line",
37,0,How to remove distance/gap between bars on plotly?,
37,0,How to use contour labelformat in plotly python?,
37,0,Deal Design by Contract to prove a Python script with decorators,
37,0,python venv creating aliases for python and python3 files instead of exec files,
37,0,Function to Password recovery email only works on localhost in django,
37,0,unet overfiting on semantic segmentation,
37,0,How to select certain indices for multiple dimensions of a PyTorch tensor?,
37,0,How do I extract clean text from the Wikisource XML Dump?,
37,0,Can&#39;t bind to AP interface in python when using create_ap,
37,0,Why does Sphinx generate indentation errors when attempting to include numpy arrays?,
37,0,Using explicit mocks for Typer CLI tests,
37,0,Missing factor of 2 when numerically integrating a 1d function on 2d grid,
37,0,How can I verify that polars is using file statistics for applying filters?,
37,0,PyQt 6.8 blank button bug?,
37,0,return header without quotes in aws lambda + remove header if empty,
37,0,using asyncio in Streamlit,
37,0,socket.connect() freezing when there is no internet,
37,0,Selenium cannot locate text field to populate,
37,0,Generating JWT token to make requests to Apple,
37,0,"How can I match python function to COM DLLs b/c when the function passes &#39;self&#39;, the number of arguments don&#39;t match?",
37,0,Spotipy invalid_client error despite correct credentials and setup,
37,0,how to convert a python np.ndarray to Java Float[] array,
37,0,FastAPI using GET with alias params,
37,0,Python is considering my button as a bool type,
37,0,Using pyspark databricks UDFs with outside function imports,
37,0,How to flatten column headers in a Python geopandas.geodataframe.GeoDataFrame object?,
37,0,How should I go about splitting faces in blender [python script]?,
37,0,Namespace Package Import Issue in Linux but Not in Windows,
36,2,nodriver crashes with infinite recursion in headless mode when running browser.get(),
36,2,Unit Test is not executable by using Pytest,
36,2,Python Sklearn.Model_Selection giving error numpy.dtype size changed,
36,2,Cognite Data Fusion Python SDK - how to delete edges that lead to a node with a specific target_edge_id?,
36,1,"Why graphviz does not work? &#39;dot&#39; is not recognized as an internal or external command, operable program or batch file",
36,1,Best way to create a list of ticklabels by multiples of pi,
36,1,How can I share one requests.Session across all Flask routes and close it cleanly on shutdown?,
36,1,How can I convert a Sequence(Image) to an Array4D without going through Seqence(Sequence(Sequence(Sequence()))?,
36,1,sns.histplot does not fully show the legend when setting the legend outside the axes,
36,1,"How to further reduce MSE/RMSE in CatBoost after tuning, data augmentation, and outlier removal?",
36,1,Flask can&#39;t load style.css,
36,1,How to check if an object is a method_descriptor,
36,1,Murmur Hash in Python outputs wrong hash,
36,1,Events not neutralised after use,
36,1,Getting &#39;Could not install packages due to an OSError&#39; when installing Python packages in GitLab pipeline,
36,1,Joined loads across multiple tables,
36,1,How python MRO works in hierarchical and multiple inheritance,
36,1,Cannot interpret &#39;dtype(&#39;int64&#39;)&#39; in NLP Python Code from adashofdata,
36,1,Check corresponding columns for null data,
36,1,ModuleNotFoundError: No module named - Even after adding module path to sys.path,
36,1,Why is stdout PIPE readline() not waiting for a newline character?,
36,1,Invalid Authority - OKX Bitcoin API,
36,1,Error: Client network socket disconnected before secure TLS connection was established on self hosted app,
36,1,eclipse - pydev - pyenv: mixing up python versions in debug mode,
36,1,Cannot import &#39;tensorflow.keras.models,
36,1,How do I successfully assign a function to the on_click event?,
36,1,Django template nested for loop from 2 different lists,
36,1,Installing cmdstanpy fast on Google Colab,
36,1,Am I using a &quot;backported module&quot;?,
36,1,How do I detect a database timeout in python?,
36,1,Azure Batch Python SDK - 5 - 10% Chance to encounter &quot;CreateTasksErrorException&quot;,
36,1,How to connect paramiko ssh with - option in python,
36,1,how to post a file to an REST api via python,
36,1,Linprog error - A_ub must have exactly two dimensions,
36,1,How can I loop thru combo boxes and set the value? My code produces the error &quot;An error occurred: &#39;str&#39; object has no attribute &#39;set&#39; &quot;,
36,1,Type error: cannot substract DateTimeArray from ndarray,
36,0,How to dynamically overlay images with ffmpeg,
36,0,"Making Headless Website backend in Django, files are becoming lengthy and unreadable, is there any better and scalable approach?",
36,0,Entity.put error after Python 3 migration for Google Data Store - refactored,
36,0,Streaming backend,
36,0,"Google Cloud Run: &quot;No route to host&quot; error for internet persists across multiple regions, even without VPC Egress",
36,0,How do determine inner border points of polygon intersection,
36,0,How to use output from colmap as an input in Nerfstudio?,
36,0,How can I get user&#39;s message and put it into a variable in bot Telethon?,
36,0,Cannot activate climada environment,
36,0,How to get the same shading and colors with Lightsource in Python on two different images,
36,0,How can a Django app on a Raspberry Pi safely trigger an upgrade of itself using apt and systemd?,
36,0,Cache access denied error when chrome driver is used to reach a portal behind a proxy server,
36,0,calculating First time right (%) using call logs dataset from a contact center,
36,0,How can I make a custom payment driver of XDC Network in Golem?,
36,0,"Extract database information like schema names, table names, column names and join conditions from AWS GLUE ETL jobs using python code",
36,0,Checking for Table Existence in BigQuery using Python or BQ CLI (shell-script),
36,0,&#39;Command python: select interpreter resulted in error,
36,0,Connect paho-mqtt using an existing python socket object,
36,0,MLflow does not upload images stored using mlflow.log_image(),
36,0,pyasn1 component-value is incompatible when attempting to set context tags,
36,0,What is the data_vars argument of xarray.open_mfdataset doing?,
36,0,Sphinx autosummary - module name repeated instead of function names,
36,0,Keep value which looks like number as TEXT in openpyxl,
36,0,Selenium. Python. Followers list on Instagram&#39;s pop-up window doesn&#39;t scroll down,
36,0,Is there a way to pre-select options for certain columns in streamlit.data_editor?,
36,0,"cv2.imshow() not showing image in Python, gets stuck",
36,0,GLMNET gives different solutions for lasso-based algorithms when I expect the same solution,
36,0,FastAPI StreamingResponse not sending message without putting sleep,
36,0,How can I overlay a Rankine cycle on top of a Temperature-Entropy plot? How can I add physical transformations on top of my cycle?,
36,0,max() output depends on order when nan is present,
36,0,Jacobi method converges faster than Gauss-Seidel in case of Laplace equation,
36,0,No module named &#39;fickling.pickle&#39;; &#39;fickling&#39; is not a package,
36,0,"I am trying to host my web app (React+Python) on Render.com (first time) and my Keras model isn&#39;t working, even though it works locally",
36,0,How to reopen a Python diskcache without creating a new one and losing all the data,
36,0,Unable to load module when wheel installed in jupyter,
36,0,Blender: Report message from previous run persists in successive run of the same operator,
36,0,Error while executing SQL query in Azure App Service - Time data mismatch,
36,0,Module (ibm_cloud_sdk_core) not found even after installing relevant package,
36,0,Redis index with multiple fields,
36,0,InvalidArgumentError with tf.data.Dataset.from_generator() at random points during training,
36,0,A question about regular expressions - can completely find all results,
35,2,Error setting find_lagrangian_options in CspaceFreePolytope.BinarySearchOptions(),
35,2,jinja2 Template output int,
35,1,Can you change the default tick density when creating a matplotlib plot?,
35,1,How to handle multi-class classification where subclasses across different superclasses are more semantically similar than within the same superclass?,
35,1,Training a custom tokenizer with Huggingface gives weird token splits at inference,
35,1,Error handling with the fitdecode library to read fit files in python,
35,1,Changing the page numbering index in reportlab,
35,1,How to pickle Enum with values of type functools.partial,
35,1,Python: using doctest with assert,
35,1,How to combine multiple chatbot pipelines into 1 big pipeline using Haystack 2.X?,
35,1,Chrome browser is not opening for few tescases when running Regression suite in Jenkins with Python,
35,1,Issue with inconsistent variable state inside button thread loop (Raspberry Pi + Flask API + threading),
35,1,python lxml and getting a table from word document,
35,1,XHR Endpoint Returning Loading Page Data Only,
35,1,gunicorn giving 404 even running successfully,
