view_count,answer_count,Query,Intent
75,2,How can I fix selenium edge driver error: session not created?,
75,2,Unexpected behavior with array slicing and mask,
75,2,Can&#39;t interact with checkboxes and button,
75,2,Logo wont show on the Taskbar,
75,2,I&#39;m trying to do a Color Detector in openCV but it just isn&#39;t working,
75,2,Binarysearch with Python with recursion,
75,1,"Mypy error, [Type] has no attribute [method]",
75,1,I do not understand how json.dump() in Python works in my specific case,
75,1,How to compute elementwise dot product of two 2D NumPy arrays,
75,1,Python &gt; yfinance &gt; yf.Ticker(symbol) throwing error when symbol not known,
75,1,Debugging Moving into Room for Text Game,
75,1,Word to excel using python but preserve word format (bullet points) and structure,
75,1,Problem converting Pandas-based ATR function to be Polars-based,
75,1,Python gunicorn not working with Docker CMD,
75,1,Adding more data causes Pandas UDF to return error,
75,1,can&#39;t load the saved model YOLOV8Backbone from keras_cv after thefine-tuning,
75,1,(SOLVED) Ctrl + Left/Right Arrow Key not working properly inside Python Interpreter,
75,1,Python: Struggling with Multiprocessing,
75,1,How to randomly choose a batch and run its next task when priority values are equal?,
75,1,CNN Autoencoder takes a very long time to train,
75,1,Generate a random matrix in Python which satisfies a condition,
75,1,Python type hinting for value that could also be a callable,
75,1,What other ways could be of representing an irreducible fraction without gcd?,
75,1,Selenium element raise StaleElementReferenceException even with explicit wait,
75,1,How do you unwrap a python property to get attributes from the getter?,
75,0,Why is the upload of files to GCP Vertex AI RAG corpora so slow?,
75,0,Get the QColor at an arbitrary position within the 0-1 range of a QGradient,
75,0,"teams notification webhook workflow in python script working on Windows, but not Linux",
75,0,wrangle function in pandas:ValueError: Mixing dicts with non-Series may lead to ambiguous ordering,
75,0,Monitoring Actual Bytes Written to Flash After SQLite Insert Operations,
75,0,Why does Ray attempt to install ray wheels from ray-wheels.s3-us-west-2.amazonaws.com?,
75,0,Inner join producing duplicative columns,
75,0,Error about bitsandbytes from Huggingface,
75,0,Is there any solution for vercel deployment error &quot;A Serverless Function has exceeded the unzipped maximum size of 250 MB&quot;,
75,0,Issue with Multi-Target Configuration in Temporal Fusion Transformer (PyTorch Forecasting),
74,2,How to modify the color of an input_slider?,
74,2,"Why does the output is 4 seconds, but real time of work is less?",
74,2,How to sum values across dicts?,
74,2,Program Functional but Output is Incorrect,
74,2,Pandas dataframe: remove rows found in other dataframe/series,
74,2,"Using .pop() with &quot;x for x in&quot;, and indexing multiple indexes in an array",
74,2,Python lambda expression add previous number to the given input,
74,2,How to create an if statement with serial data?,
74,2,How to get field value from array of objects in python?,
74,1,Azure Functions Service Bus Triggered not working,
74,1,Orderby and distinct at the same time,
74,1,Why are the subplots in the subfigures getting smaller?,
74,1,How to profile code where the time is spent in imap_unordered?,
74,1,Running bazel/uv/python,
74,1,HttpsConnectionPool Error Selenium: while paste 3000 ids from column in a csv file using Selenium in input field of a URL. Works well for 200 ids,
74,1,For-loop with the walrus operator inside the range,
74,1,How can I check having functions with specific return type but without return value with ruff?,
74,1,Why is my Python code displaying CSV file with right sided alignment?,
74,1,API returns 503 error when POST request takes too long,
74,1,Getting an error &quot;AttributeError: module &#39;tensorflow.python.distribute.input_lib&#39; has no attribute &#39;DistributedDatasetInterface&#39;&quot;,
74,1,How Can I Match Percentile Results in Postgres and Pandas?,
74,1,Extracting Images from a PDF using PyMuPDF gives broken output images,
74,1,Nondeterministic behaviour of openpyxl,
74,1,Find the value that is different when a row is marked &quot;left_only&quot; or &quot;right_only&quot; when comparing Pandas DataFrames,
74,1,Problems when using np.arctan2 to plot domain colored complex function,
74,1,Why does browser ignore html code when displaying server-sent events,
74,1,What is the programming construct in Python of passing some arguments in front of a constructor call? How to interpret parameters passed to an object?,
74,1,Django&#39;s SQL query has repeated subquery when using filters with annotations and subqueries,
74,1,Convert JSON object to Pandas DataFrame ensuring that Key is considered as column label,
74,1,Barplot coloring using seaborn.color_palette,
74,1,How to flatten nested JSON in pyspark,
74,0,How to invoke a Gemini Fine tuned (via Vertex AI) model in Google ADK Agent,
74,0,Google OAuth Refresh Token Causes Infinite Redirect Loop After Logout and Re-Login in Django App,
74,0,Matplotlib contourf input array shapes error,
74,0,pip building wheel for wxPython on Ubuntu,
74,0,UnicodeDecodeError using PostgreSQL DB for DRF project on Windows,
74,0,Nodriver Get Page Status Code and Refresh,
74,0,Accessing an element inside an iframe using nodriver,
74,0,Why are date and time data not mapping/uploading to PostgreSQL with the correct datatype?,
74,0,Can you wrap NumPy functions in Numba-jitted code using llvmlite?,
74,0,"Why can&#39;t SymPy calculate the Sum(1 / ((k + 1) ** 4 + 1), (k,-oo,oo)) when it appears to converge?",
74,0,Insert carousel above Main Screen Behind Slider Control in Kivy,
73,5,Accidentally set a wrong default value in Django model,
73,3,Clearing clipboard on program exit in python Tk and Kubuntu,
73,2,"How to detect and scrape a specific language version of a multilingual publication, if available?",
73,2,Ensure uniform group sizes using NumPy,
73,2,deviation in solutions (differential equations) using odeint vs runge-kutta-4th,
73,2,Plot multiple dataframes&#39;s columns in same subplots using df.plot,
73,1,Search results don&#39;t show up on choosing &quot;Full Category&quot; using Flask,
73,1,How to add space between Bubbles and increase thier size,
73,1,Gathering and change multiple excel files columns based on another excel file with the new column names for each using python,
73,1,Why does pip install fail due to project layout when installing dependencies?,
73,1,Browser gets automatically closed without using quit or close method,
73,1,Calculate gamma functions in python without external packages (besides &#39;math&#39;),
73,1,Read logs from cloud run function in python,
73,1,Creating new rows in a dataframe based on previous values,
73,1,Ask for information about the Bubble sort algorithm,
73,1,Get the maximum frequency of an audio spectrum,
73,1,"In python: oracledb.connect simply hangs, even when the local client succeeds. Why?",
73,1,How to use validators in pydantic for default values in combination with ORM mode?,
73,1,Why std(skipna=False) and std(skipna=True) yield different results even when there are no NaN or null values in the Series?,
73,1,PayFast signature (python): generated signature does not match submitted signature,
73,1,Index Pandas with multiple boolean arrays,
73,1,How to include code-block headers in sticky-scrolling for python code?,
73,1,Read-in a csv to Pandas dataframe with timestamp and convert it to isoformat,
73,1,"How to handle German language specific characters like (&#228;, &#246;, &#252;, &#223;) while tokenizing using GPT2Tokenizer?",
73,0,Why does my Python script run significantly slower on Windows than on macOS for the same task?,
73,0,"Python says it has inserted row into DB, but it hasn&#39;t",
73,0,How to fix `InvalidRequestError: Can&#39;t attach instance &lt;ClassName at 0x7baada2f3cb0&gt;` in SQLAlchemy relationships?,
73,0,PyAirbyte - Collect data from a Google Sheet,
73,0,How to &quot;squeeze&quot; bounds to some number on both sides of a calculation [Python],
73,0,How to use Python type hinting to mock values and perform static analysis when a value can exceed a bound at runtime?,
73,0,Unable to authenticate Django user with email instead of username,
73,0,How to Create discord bot commands from the server,
73,0,How to debug Python functions in Rstudio?,
72,3,Problem with a Lineup Optimizer due to players having multiple Positions,
72,3,How to remove padding coming from tick labels from other subplots,
72,2,Cosine with a Gaussian envelope fit failing in python using scipy.optimize.curve_fit,
72,2,How to get data from &#39;Balance Sheet&#39; on &#39;Google finance&#39; with Python and Selenium?,
72,2,unexpected keyword in createsuperuser django,
72,2,Extract Fields used in SQL query,
72,2,Python Pandas.read_csv header and index column not lining up,
72,2,How do I check for null column values in a Pandas DataFrame?,
72,2,"Discord.py, commands.error: &quot;roll&quot; not found",
72,2,How do I get someone&#39;s specific Discord ID,
72,2,Filter sequences of same values in a particular column of Polars df and leave only the first occurence,
72,2,How to create a new column based on an existing column matching one of four lists?,
72,2,"Using vectors to manipulate columns, and add new ones, in multiindex dataframes",
72,2,python cv2 replace color with white,
72,1,Azure python sdk resourcegraph no skip_token,
72,1,Installed my own package but python can&#39;t find the modules,
72,1,How to properly extract all duplicated rows with a condition in a Polars DataFrame?,
72,1,"Python abstract methods for Children, but such that don&#39;t prohibit instances of the Base?",
72,1,How to use Model-View with a QCheckBox?,
72,1,why use super() to call functions?,
72,1,Flask HTML Cootie Catcher -- 415 Unsupported Media Type,
72,1,Detecting an object in an gradient background going wrong,
72,1,"Get a grouped sum in polars, but keep all individual rows",
72,1,Slow Python Async Playwright tests when running with with async_playwright() as p:,
72,1,How to make pexpect wait for full execution?,
72,1,Create boolean columns from string column,
72,1,Python - SciPy: Monitoring the progress of the optimization (as debugging),
72,1,Seeking Advice on Efficient Pandas Operations for Conditional Summing,
72,1,saving statsmodel to adls blob storage,
72,1,How to resample a dataset to achieve a uniform distribution,
72,1,Downsampling spectra with Pandas,
72,1,lxml target interface splits data on non-ascii characters -- how can I get the whole string?,
72,1,Python Typing: Put Constraint on Annotated,
72,1,How to generate an authorization code from a given scope and use it to generate a refresh token in Python for Zoho CRM API?,
72,1,How do I find classes that are decorated by a given decorator in Python?,
72,1,Prevent test functions from being bundled with Python package,
72,1,how to make all field optional with alias name?,
72,0,I have a very noisy dataset that I want to analyze using a neural network,
72,0,Why does yt-dlp work locally but fail with a bot error in production (live environment) even with cookies?,
72,0,"Can&#39;t set seeker in GSTREAMER cv2, python",
72,0,Unable to trigger dynamically created pipelines in airflow DAG,
72,0,Regex ‘priorities’ for searching and groups?,
72,0,sqlite3.OperationalError: unknown function: CONCAT_WS() when querying a virtual column with SQLiteODBC,
72,0,Can&#39;t get my Flask app to run as a bot in Azure Web App Services,
71,4,Formatting pandas tables that contain lists of floats,
71,3,Apache Spark left join python databricks,
71,3,Ways to prevent tkinter from opening a graph on each plot drawn/draw in a selected frame?,
71,2,Iterate over a Dataframe column and find value based on condition,
71,2,How to annotate dict-like object with key-value structure in Python?,
71,2,Conditional Sum in Pandas based on current row value,
71,2,Trying to exeute the DBMS_STATS function in a python script,
71,2,What is the most efficient way to get length of path from adjacency matrix using numpy?,
71,2,How to read 10-K XBRL file using python?,
71,2,type hinting signature of handler for signal.signal,
71,2,Pytest fixture is changing the instance returned by another fixture,
71,2,"OpenCV cv2.waitKey() cannot detect the Delete key, what should I do?",
71,2,python script to check if the downloaded file from URL is corrupted or not,
71,2,problem in solving closest palindrom number,
71,1,How to pass a List of strings as FormData to FastAPI using JavaScript Fetch API?,
71,1,Problems with Tkinter libraries dependencies in a codespace on Ubuntu 22.04.1 (linux),
71,1,How to await messages and not affect the main event loop?,
71,1,Spacing between widgets in tkinter,
71,1,Warm up HuggingFace Transformers models efficiently to reduce first-token latency in production,
71,1,How to prevent unescaped program arguments,
71,1,Matplotlib vertical grid lines not match points,
71,1,Why does BeautifulSoup in Python give me an unexpected output?,
71,1,Cookie cannot be added to website in selenium,
71,1,Mock asyncio.sleep to be faster in unittest,
71,1,How can I create a GIF image using Pillow and imageio with Python?,
71,1,Excessive NaNs when resampling + interpolating in Pandas,
71,1,404 error on Python App deployment on CPanel,
71,1,NameError: name &#39;ONNXMiniLM_L6_V2&#39; is not defined when trying to use pyinstaller,
71,1,python base64 string - how to decode first 8 bytes,
71,1,Monotonic multivariate scattered interpolation in python,
71,1,How to recreate this tile plot in python,
71,1,Creating a value array from a list with varying size,
71,1,Is there a callable for generating ids with `pytest.fixture(param=...)` the same way it would be generated with `pytest.mark.parametrize()`?,
71,1,Can&#39;t eliminate floating point errors with Decimal,
71,1,XPT files values differ from expected values,
71,1,The error of manually computed inverse-FFT increase along x_axis,
71,1,Python command line tool with subcommands in typer - How do I include a Typer instance with only one command?,
71,0,Pytorch - torchvision model getting different results in python and kotlin,
71,0,Python FPDF not rendering Unicode Text,
71,0,How to create an &quot;Open file&quot; dialog box in Python for a GIMP 3 plugin with GIMP 3 style/colors?,
71,0,Typehints in Python including the default values,
71,0,Assert a logger writes to stdout,
71,0,Python: partial TypedDict for a wrapper function (mypy),
71,0,Changing tkinter elements from other files in python,
71,0,Year comparison,
71,0,Error to find module debugpy when debugging Python,
71,0,Error in Buildozer while compiling a Kivy app,
70,3,Is there a cleaner string cleaning for my string in python,
70,2,How to use a class property as a decorator in Python?,
70,2,Fully hide margins on maps added to streamlit,
70,2,How can I view the xpath of a selected element?,
70,2,"Python for xml parsing, how to track correct tree",
70,2,Trouble constructing left join query,
70,2,find the min of int value mixed with string value in a nested list in Python,
70,2,how to read a file and reformat some columns into new rows,
70,2,Install an old python (3.9) in a pipenv with non LTS Ubuntu,
70,2,FFT Does Not Detect Expected Frequencies in Experimental Data with Known Periodicities,
70,2,Raising Error in Function task-parallelized with Ray,
70,2,"calculate pearson correlation of each rows in 2D numpy array (n,m)",
70,1,Comparison of Frequencies array to FFT indexes,
70,1,How to improve ip-api locator,
70,1,How to reduce GPU memory usage when running Stable Diffusion with HuggingFace Diffusers?,
70,1,SVG element not visible in streamlit,
70,1,Python asyncio Lock.release(): object NoneType can&#39;t be used in &#39;await&#39; expression,
70,1,Strange behaviour from python 3.13 on | operator,
70,1,How to convert matrix of binary numbers into matrix of strings/symbols?,
70,1,Why does sympy.LT(A) / sympy.LT(B) and sympy.LC(A) / sympy.LC(B) produce different results if A and B are polynomials with the same degree?,
70,1,What&#39;s wrong with numpy_nullable and NaNs?,
70,1,Regression error with Python tensorflow keras,
70,1,insertionsort different algorithm,
70,1,How to do a groupby on a cxvpy Variable? is there a way using pandas?,
70,1,Inverse groupby to assign parent dataframe?,
70,1,Running a function through a for loop with a change in the index in a variable,
70,1,Implementing StrongSort with Ultralytics YOLO,
70,1,Implement the __getitem__ method of a minimal collections.abc sequence with type hints,
70,1,Adding an upstream relative path to project in pyproject.toml,
70,1,Convert the values in a SQL array by SELECTing from another table?,
70,1,RegexTextSplitter does not exist in langchain_text_splitters?,
70,1,DeepFace Analyze - Test scripts for batched image processing,
70,1,How do conditional expressions group from right to left?,
70,1,"After scraping data from website and converting csv, excel don&#39;t show rows except columns",
70,1,Why is a line read from a file not == to its hardcoded string despite being printed as the same thing?,
70,1,Numpy Structured Array - Memory copy error,
70,1,Multiprocessing.Process with spawn vs Subprocess.Popen,
70,0,Sunset/rise calculation,
70,0,How to import tensorflow?,
70,0,How to pass a dataframe variable to a function in python,
70,0,"When trying to index from a series, why it just showed one element instead of one row?",
70,0,Is armv7 supported by polars?,
70,0,"Querying data iteratively, is there a better way of doing this?",
70,0,Icons are not displayed when making diagrams (Python Diagrams),
70,0,Type hint private member variable of subclass more specific than superclass,
70,0,Seaborn swarmplot,
69,3,Why do I have 2 red dots on my KivyMD2.0.0 screen. I am using a KV string and I am rendering it. How to correct this?,
69,2,SCIPY BPoly.from_derivatives compared with numpy,
69,2,Different Variable in while loop,
69,2,How do I repeat one Dataframe to match the length of another DataFrame,
69,2,How to select / save rows with multiple same value in Pandas?,
69,2,Extrusion of a curve in Matplotlib,
69,2,Is it good practice to override an abstract method with more specialized signature?,
69,2,Residual Analysis for simple linear regression model,
69,2,My code cannot match the name of a movie that the user entered in the dataset,
69,2,Not able to pass Column names as parameterised in ADD COLUMNS command in databricks-sql connector (needed to resolve SQL Injection Snyk Vulnerability),
69,1,How to translate Python into R to access API for Open AI?,
69,1,Runtime Error: No Running Event Loop on Streamlit with Docker,
69,1,How do I keep both columns as the result of a Polars join with left_on and right_on?,
69,1,The underlying compression routine could not be loaded correctly error when deplying Function App,
69,1,How to correct a ParserError when respecting the CSV delimiter and a second ParserError on URL string not expected with the delimiter defined?,
69,1,How to render Power BI slicer items with Python Selenium,
69,1,Why am I getting TypeError: &#39;int&#39; object is not iterable in my Python function?,
69,1,Firefox Selenium WebDriver Timeout in OpenShift Pod,
69,1,delete the redundant axis in colorbar,
69,1,Selenium doesn&#39;t open website with provided url (url is valid),
69,1,MongoDB: Establishing a connection is SUPER slow,
69,1,Handle cosmos DB connection in Function apps,
69,1,How to have a GDB/Python script use pipes for input and output of debugging target,
69,1,Actual practical advantage of SQLAlchemy scoped_session vs classic session in worker,
69,1,"sqlAlchemy to_sql with azure function returning collation error, but work without issues if executing just the python file",
69,1,dbutils secret issue for container url,
69,1,How do I send email using client credentials flow such that sender&#39;s mail is included?,
69,1,Is with concurrent.futures.Executor blocking?,
69,1,Conda environment does not isolate each environment,
69,1,"Use a python regex expression to replace spaces between words in string1 with underscore, and add string2 at the end of string1",
69,1,how to extract omr data in python?,
69,1,SQLite find primary keys in python,
69,1,How to implement WebDriver Event Listeners in Robot Framework,
69,1,python numpy matrix multiplication for coordinate transformation gives a wrong result,
69,1,Why does a numpy transpose break mediapipe&#39;s Image command?,
69,1,Comparing numpy versus scipy when sampling random values from a poisson distribution,
69,1,libexchange MalformedResponseError error=&quot;invalid_token&quot;&#39;,
69,1,Why is the current date number not showing on a tkcalendar restricted to only select Monday weekdays?,
69,1,Extreme value analysis and quantile estimation using log Pearson type 3 (Pearson III) distribution - R vs Python,
69,0,Some technicallities before getting started,
69,0,Installing Django with Pythonista and Stash gets errors : name &#39;sys&#39; is not defined with &#171;&#160;import sys&#160;&#187; in script,
69,0,PyTorch with Docker issues: torch.cuda.is_available() = False,
69,0,Image/color recognition and scanning/timing,
69,0,I am trying to import categories but lines that have a parent is causing an issue,
69,0,Why doesn’t the barycenter method detect subpixel displacements where correlation does?,
69,0,Accessing Docling features from within spaCy Layout in Python,
69,0,"How to read voltage, current, and battery percentage via Bluetooth from an MPPT solar controller (ZhiJinPower app)?",
69,0,Set SwaggerUI Access Token on App Startup,
69,0,Virtual environment won&#39;t start in ipynb in VScode,
69,0,How can I raise my API level from 31 to 34 in google play console,
69,0,How to speedup cupy code with frequent data transfer &amp; writing,
69,0,VS Code Python Debugger fails du to incorrect command line,
68,3,Why is the width and height being ignored at runtime?,
68,2,Why does my approach to destroy window fail?,
68,2,Why cv.convexityDefects fails in this example? Is it a bug?,
68,2,How to generate a list of words using random letters?,
68,2,How do I make a script accessible across all directories within a python monorepo using uv?,
68,2,What&#39;s wrong with this tkinter script,
68,2,Format String based on List of Dictionaries,
68,2,Numpy- strange behaviour of __setitem__ of array,
68,2,How do I type a generic subclass correctly?,
68,2,Mergesort and index out of range in Python,
68,2,Return Pandas dataframe row,
68,1,How to mark a unit test with `pytest` as a success if a single assertion among many does not fail,
68,1,Queues in Python loop does not give me a choice to put input?,
68,1,2D plots in plotly cannot show small variations,
68,1,TKInter widget not appearing on form,
68,1,How to implement subgraph memory/persistence in LangGraph when parent and subgraph states diverge?,
68,1,Wrapping a python sub process,
68,1,How to update a leaf variable in PyTorch,
68,1,Double bar stacked bar plot in plotly dash,
68,1,Not receiving INIT action from WhatsApp Flows after sending an interactive flow or template?,
68,1,How to make Telebot respond &quot;I don&#39;t understand&quot; when user sends unknown text?,
68,1,how to install keyboard module python 3.12.3 on linux mint,
68,1,OpenAI Assistants with citations like【4:2†source】and citeturnXfileY,
68,1,Django Advanced Tutorial: Executing a Command in Dockerfile Leads to Error,
68,1,Why do model.evaluate() vs. manual loss computation with model.predict() in tf.keras do not add up?,
68,1,How to automatically start the debugging session in Playwright?,
68,1,Build aggregated network graph from Pandas dataframe containing a column with list of nodes for each row?,
68,1,Shuffle a dataset w.r.t a column value,
68,1,Using zip() on two nn.ModuleList,
68,1,Getting [Errno 22] Invalid argument when trying to access data variables,
68,1,Inserting value into MYSQL using FlaskAPI in Website,
68,1,"How do I interpret scipy.optimize.minimize convergence metrics? Specifically, nit, nfev, njev in the output",
68,1,"Can I specify the replacement character in str([value], encoding=&#39;utf-8&#39;, errors=&#39;replace&#39;)",
68,1,Field validator not called on SQLModel,
68,1,Python Azure Function nested code can&#39;t find modules even with init files,
68,1,Iterate xml using namespace prefix,
68,0,Type-hinting a structure-preserving nested map in Python,
68,0,VS Code python extension seeing some not all Django class,
68,0,What am I doing wrong with how I&#39;m referencing my Python variables?,
68,0,How should I document Python constants so they are reflected in the comments of the code and Sphinx?,
68,0,"Current solution for Project Euler+ 250 (HackerRank) is giving incorrect answers, why is this?",
68,0,Discrepancy between C++ FFTW and pyFFTW,
68,0,Python - stress test all 24 CPU cores,
68,0,Loan Default Prediction - Kaggle,
68,0,Can olmocr Run on Two 12 GB Titan X GPUs?,
68,0,Mirror SQL Server to DuckDB local database with SQLAlchemy: constraint not implemented,
68,0,FastAPI Dev taking very long to start the server whereas uvicorn main:app --reload --port 8000 works,
68,0,Unable to access MySQL server in Python,
68,0,how to install python package in 2025 ? Datascience,
68,0,How to immediately sent 200 Ok response in Flask?,
68,0,Parse through not well-formed XML in python,
68,0,Query returns None in Celery tasks,
67,2,Why am I getting an extra space here?,
67,2,Check whether one string can be formed by another string in Python,
67,2,Django Model: unexpected keyword arguments in constructor,
67,2,How can I concatenate columns without quotation marks in the results while avoiding SQL injection attacks using psycopg?,
67,2,How to use typeguard for numpy structured arrays?,
67,2,Read and Extract details from Log file,
67,1,Problem nesting QT layouts when using if &lt;QT layout&gt; statement,
67,1,Amazon SP-API sandbox Orders API returns 403 Unauthorized despite LWA token and SigV4 signing,
