view_count,answer_count,Query,Intent
54,2,How to create a while loop with integer inputs in Python using a sentinel value that is not an integer,
54,2,Cant run discord commands made in python,
54,2,numpy timedelta highest unit without loss of information,
54,2,Inconsistent results with pandas styler applymap,
54,1,Convert a Diagonal Metric into vertical table,
54,1,KeyboardInterrupt doesn&#39;t work as expected in while loop while monitoring keyboard input,
54,1,Matplotlib showing chosen values instead of a normal range,
54,1,Why does to_datetime() distort (squish) the original function shape?,
54,1,Polars .list.eval(): difference between pl.element() and pl.all(),
54,1,Python 3 unit test,
54,1,"How to display &#39;years&#39; on the the y-axis of horizontal bar chart subplot when the scale is in months, without changing the plotted data itself?",
54,1,Problem faced in CP-SAT when using OnlyEnforceIf,
54,1,How to check the response type in the middleware?,
54,1,How can I stop my tkinter hangman game accepting a correct letter more than once?,
54,1,How is an instance attribute of the same type as the instance type-hinted?,
54,1,How to smooth out a 3D boolean mask?,
54,1,Is there a way to get Revit Python Shell not to buffer the print statement?,
54,1,sqlalchemy DML statement cannot have any enabled triggers,
54,1,sqlite3.OperationalError: unable to open database file in virtual enviornment,
54,1,Label Studio not presenting the labels and OCR text,
54,1,(Other ways/optimization)Transform the random dimensional shape list into a single dimensional list in Python,
54,1,How can I efficiently share schemas and utils between micro services in a monorepo approach,
54,1,"Fastest and cleaner ways to insert, update, delete 2-dimensional array",
54,1,windows cmd auto-indent for python codes problem,
54,1,Notepad++ renaming tabs with python scripts,
54,1,Flask - Problem with passing variables between routes OR with sessions,
54,1,Matplotlib not rendering chart in Jupyter (Conda),
54,1,Django models migration gets generated after managed set to False,
54,1,Getting the X and Y coordinates of a Tkinter widget placed with grid,
54,1,Multi-processing copy-on-write: 4 workers but only double the size,
54,1,I&#39;m having trouble trying to convert image to text in python,
54,1,Paddle OCR fail to extract single digit,
54,1,Dependency error when using a cloud storage connector with Hadoop 3,
54,1,Is there a logical reason behind the indexing used for the range() function in python,
54,1,How can I return a list nested in a class,
54,1,How to do fitting on experimental graph and theoretical graph,
54,1,How to use python-pptx to extract infrequent tables?,
54,1,Read file and insert into map,
54,1,No space error while running Spark from Airflow,
54,1,How to integrate two objects of differing dimension alongside each other?,
54,0,"When using Python Flask for the backend and Next.js for the frontend, if I am unable to retrieve data from the backend, how can I resolve this issue?",
54,0,close or not close file descriptor in a function body?,
54,0,Calculating large numbers in a RAM efficient way,
54,0,Speaker Diarization,
54,0,How hard is the AP Computer Science Principles test,
54,0,"I&#39;m getting a conversion error after running .hist() method, does anyone know if I&#39;m missing an argument?",
54,0,Sympy won&#39;t accept I as a symbol while differentiating,
54,0,Issue with pyflink api code for inserting data into sql,
54,0,How do everyone see Cython definitions?,
54,0,why are these python regex not the same: &#39;\.0$&#39; vs r&#39;.0$&#39;,
54,0,pip download is building something,
54,0,Why don&#39;t I get the expected neighbor indices with OpenCVs KNearestNeighbour?,
54,0,How to disable certificate invalid error in UI while automating using Python Playwright,
54,0,sqlalchemy.exc.ProgrammingError: Invalid object name &#39;users&#39; while querying SQL Server with pyodbc,
54,0,Issue with Positioning Images and Pipelines in Word Documents Using win32com,
54,0,How can I access the original xlo/xhi box bounds from a LAMMPS dump file using MDAnalysis in Python?,
54,0,Using the free-proxy library with requests to access general https websites,
54,0,tox is not installing build requirements,
54,0,"Should I use Pydantic with `typing` module (`Dict`, `List`, etc.) or native Python types (`dict`, `list`)?",
54,0,"How do I convert Excel to CSV, but preserve the dates using Python?",
54,0,Best practice for function-level reproducibility of random number generation with NumPy,
54,0,Applying a custom function to Xarray resample drops the dimension coordinates,
53,3,Python Error collecting try..except info from source,
53,2,Why is my flask application taking soo long to connect to the Oracle database from PCF?,
53,2,Is there simpler way to get all nested text inside of ElementTree?,
53,2,Comapre two DF with different lengths based on same column name,
53,2,Accessing MS 365 content dynamically from a Python script,
53,2,Trying to access the directory but got this error,
53,2,BeautifulSoup Not Finding Table Headers on ClinicalTrials.gov Despite Inspect Element Showing Them,
53,2,Do I need a local install of Firefox if using Firefox driver in Selenium?,
53,2,Python subprocess run error: &#39;FileNotFoundError&#39;,
53,2,Django Select2 Autocomplete: How to Pass Extra Parameter (argId) to the View?,
53,2,Create a New Django Web App with MS Sql Server as backend db,
53,2,Class instantiation in python multiple inheritance and passing arguments,
53,2,TextVariable not updating in Tkinter,
53,1,How can I subtract each group’s mean from its rows in Pandas without losing the original row order (and without apply)?,
53,1,What flow control paradigm is good for a Taco Bell assembly line?,
53,1,Matplotlib figure with 2 animation subplots: how to update both,
53,1,Error Running Spark Job from Django API using subprocess.Popen,
53,1,"How to detect MIME type from a file buffer in Python, especially for legacy Office formats like .xls, .doc, .ppt?",
53,1,Debugging scipy.minimize,
53,1,How to interpolate circle arc with lines on Earth surface?,
53,1,Is a lock needed when multiple tasks push into the same asyncio Queue?,
53,1,Facing an error while looping through list and saving the data,
53,1,Issues retrieving books by ISBN using Google Books API,
53,1,"How to know if a Python package (e.g., ipykernel) is preinstalled on macOS — and whether it&#39;s safe to uninstall?",
53,1,Feasibility of Dynamically Reusing Common user defined functions Across Multiple DLT Notebooks,
53,1,Jupyter running into a large subset download warning,
53,1,Items getting dropped while adding a list to queue,
53,1,MS Graph - Application Only - Sending Emails from Shared Mailbox as Daemon,
53,1,NumPy Package won&#39;t load in Jupyter Notebook,
53,1,Solving a PDE backwards with FiPy,
53,1,Polars wheel file,
53,1,Is it possible to use python-social-auth&#39;s EmailAuth with drf-social-oauth2 for registration,
53,1,How can I use a local Python package during development while keeping a Git dependency in pyproject.toml?,
53,1,What is leading to the infinite loop?,
53,1,Issue running HydroMT Hydrological Plugin for Wflow model execution during Docker build process,
53,1,identify the overlapping date ranges pandas,
53,1,How to issue warnings from a `attrs` validator with correct `stacklevel`?,
53,1,CLRS Merge Sort Index out of bounds,
53,1,MSIX Packaging Tool - Failing Installation,
53,1,How can I pass environment variables to a custom training script in Amazon SageMaker using the Python SDK?,
53,1,how to preserve (unknown) datatypes when creating a df from existing dfs with partially differing column names,
53,1,How to change the Bluetooth name of the Raspberry pico 2W?,
53,1,Adding Tags and Triggers to GTM with Python,
53,1,Word to Number project,
53,1,Python Version Management with Pyenv on MacBook Pro,
53,0,Can Python alone help me build a personal assistant?,
53,0,Unable to fetch user list from google workspace due to: Resource Not Found: userKey,
53,0,Selenium intermittently fails to find JavaScript-injected data (&quot;venueProfile&quot;) in page source,
53,0,Beginner - How to set program arguments in vscode,
53,0,Function to convert .msg file to .pdf,
53,0,Detect usage of a (vulnerable) function in a imported module?,
53,0,PyQt6: Unwanted Bounding Box Around My Round Button Overlay On Top Of VLC Video Widget,
53,0,Use snowflake-connector-python in AWS Lambda,
53,0,Is the first function deterministic after executing .orderBy() on the DataFrame?,
53,0,Zoho CRM: Getting &quot;too many requests&quot; even when caching access token until expiry,
53,0,How does Python&#39;s garbage collector handle circular references in custom objects?,
53,0,"Python 3.11, Flet 0.27 — how to reduce Dropdown size?",
53,0,rioxarray and clip for a netcdf,
53,0,How to resolve &#39;Broken pipe&#39; error when accessing GPS data via Python while Minicom works fine?,
53,0,How to stop system tray Icons from grouping together,
53,0,FastAPI Async Setup,
53,0,python/Jupyter-lab: How to use built-in JSON visualization functionality for a dataclass,
53,0,do anyone get this error while installing chromaDB?,
53,0,Selenium webdriver isn&#39;t clicking on checkbox,
53,0,Error while installing transformer_engine,
53,0,Python Intellisense tooltip forever &quot;Loading&quot; in Cursor AI Editor,
53,0,filedialog doesn&#39;t return anything on second run,
53,0,Unclosed file warning using asyncio Python,
53,0,Adding a large .shp file to a Streamlit app,
52,3,Python ModuleNotFoundError importing from sibling sub directory modules,
52,2,How to make ty ignore a single line in a source file?,
52,2,pyqt5 TableWidget won&#39;t display items until function is complete,
52,2,Running Python Modules (-m) - Relative Path Error - Python 3.12.8,
52,2,Make colorful checkmarks using input comment,
52,2,Worker cannot find external file in Apache Beam,
52,2,How to add jitter to plotly.go.scatter() in python when mode=&quot;lines&quot;,
52,2,Get Line2D object from LineCollection,
52,1,Permission Denied while building Django project with Docker,
52,1,How to extract RGB values for LinearSegmentedColormap,
52,1,Is polars bracket indexing to select a column discouraged?,
52,1,"Polars for Python, can I read parquet files with hive_partitioning when the directory structure and files have been manually written?",
52,1,How do I write a join in FastAPI with SQLModel?,
52,1,Is it possible to implement parallel timer in python for async task?,
52,1,GUI on top of all windows in windows that does not interfere with clicking on other windows,
52,1,Python pg8000 query params...syntax error at or near \”$2\&quot;,
52,1,How pull reference values of environment variables on Azure App Service,
52,1,"urlparse/urlsplit and urlunparse, what&#39;s the Pythonic way to do this?",
52,1,"tkinter layout problem, pack does not place the elements as expected",
52,1,How to add deep colored edges to the bars of a histogram with the same filled color of the bars?,
52,1,How to switch to a popup cookie consent page?,
52,1,The test with SearchFilter in pytest is not stable,
52,1,TypeError: Dataloader object is not subscriptable,
52,1,How to achieve similar desmos visuals in manim,
52,1,How can I correct my JSON Response? It is not working on DialogFlow,
52,1,"When using venv, packages I&#39;m building suddenly disappear when others are installed",
52,1,Is there a way to instrument python code like this to run my tracing function on it?,
52,1,Python plotly express line chart with cumulative sum 2,
52,1,Cannot set cookies when using StreamingResponse in FastAPI route for SSE (Server-Sent Events),
52,1,Issue during file handling in python while &#39;write&#39; operation,
52,1,How to efficiently apply batched edge/node modifications across multiple graph copies using precomputed data?,
52,1,Snakemake - Call multiple scripts in a rule,
52,1,How to detect the edge of concatenations images by computer vision?,
52,1,LLDB breaks on adding a breakpoint using python,
52,1,Tensorflow error unknown expected keyword during loading of trained model,
52,1,Read text from file while keeping byte offset,
52,1,Why does this Genetic Algorithm give such bad solutions to a TSP?,
52,1,WxFormBuilder warning - First ID is less than 5999,
52,0,what&#39;s IA and how can i use them,
52,0,GPU to GPU direct data transfer with connectX and RDMA,
52,0,why is my script only returning 0.00 for cpu_usage?,
52,0,Python - List of list with indefinite number of list and operation,
52,0,Open Word document as &quot;Read Only&quot; with API doesn&#39;t work,
52,0,FastMCP logs are not visible when tools are called,
52,0,Slash command not responding and error when I use defer() or response.send_message (python),
52,0,Why is this method of tkinter collision not working?,
52,0,Incompatible type hints for AST node subclasses,
52,0,How to create list of UUID field,
52,0,I am having a urllib.error.HTTPError: HTTP Error 400: Bad Request when using the YoutubeVideoSearchTool in CrewAI for Python,
52,0,Python equivalent to the R `bench::bench_memory()` function?,
52,0,Improving OCR Accuracy for Digits Inside Circles from Vector PDF Images (AutoCAD Export),
52,0,PySide6 QImage conversion to PyQtGraph ndarray,
52,0,Python socket server recv() hangs,
52,0,Sphinx can&#39;t see function inside of my class when it builds,
52,0,Dash / Plotly: 3D camera resets on every update on mobile (Android/iOS) despite uirevision=&quot;lock&quot;,
52,0,How to nest mpi processes with python,
52,0,Accessing a foreign key&#39;s base classes&#39;s fields in UniqueConstraint,
52,0,Need a function to overlay a pdf (containing comments) as a layer on another pdf,
52,0,Resolve inconsistent categorical mapping after DataFrame concatenation,
52,0,Error When Using Batch Size Greater Than 1 in PyTorch,
52,0,"How do I include the os module with IronPython 3.4 in my C# project, and also run a script?",
52,0,Python code snippet raising error: &quot;TypeError: can only be called with ndarray object&quot;,
52,0,Calculate the gradient with respect to attention but also the FFN layers for a pre-trained LLMs,
52,0,Best Practices for Preserving Hashed Identifiers in Filenames After Character Sanitization for Accurate Merging,
52,0,Implementing survey weights in statsmodels OrderedModel ordinal logistic regression,
52,0,Trouble installing pyenv with brew on mac due to openssl version,
52,0,Failure while installing Python requirements in Windows System,
52,0,NER Results Empty in Query Processing Despite Parallel Intent and Entity Extraction (Showing empty NER Results),
51,3,Error entering search after clicking a radio button using Selenium in Python,
51,2,"Trying to deploy Django web app on PythonAnywhere, &quot;no python application found&quot;",
51,2,How to access &quot;Groups&quot; folder in Outlook using pywin32,
51,2,How can I delete a row from a csv file?,
51,2,Making file hidden in Windows using Python blocks file writing,
51,2,Python raw manually crafted packets sending problem with socket .sendto(),
51,2,pandas 2.2.3: `astype(str)` returns `np.str_`,
51,2,How to specify actual class in Pydantic member,
51,2,Access text elements with dynamically loaded classes using Selenium,
51,2,Stratified sample split,
51,1,"Python loop over nested generator with two variables, in one for loop",
51,1,Is there any way to use a string variable instead of an actual string in quotes for labelids in service.users().messages().list?,
51,1,Fixed aspect ratio for a window on Tkinter,
51,1,How to inject a global httpx.AsyncClient session in FastAPI using dependency injection?,
51,1,Receive management messages in my own consumer,
51,1,Downgrade to Python3.10 or 3.8 on Colab,
51,1,Stop Otel from tracing its own internal metric exporting activity,
51,1,Use anyc_playwright within multithreaded Prefect flow (`_channel` seems to be `None`),
51,1,"Error connect with Cloud SQL, Cloud Run and Django",
51,1,Python script locked by thread,
51,1,Default of an argument in two different spots,
51,1,Using WinRT Interface in Python,
51,1,Constrain Llama3.2-vision output to a list of options,
51,1,How to calculate the derivate of a python pandas dataframe given vector values and coordinates?,
51,1,Is there a Manim/Python function to turn a moving shape (or line) into a drawing tool?,
51,1,How can I make Spyder run files without a python extenstion?,
51,1,set priority on Queryset in django,
51,1,Not able to generate graphviz when runing on Mac,
51,1,pyserial-asyncio client/server in Python 3.8 not communicating immediately,
51,0,Implement the &quot;Retail MAC&quot; for BAC passport authentication,
51,0,"In pyright strict mode, how to use np.char.add?",
51,0,Behaviour of Jupyter &quot;code&quot; cells has changed,
51,0,Updating Excel files with Python,
51,0,What does &quot;NSWindow geometry should only be modified on the main thread&quot; mean?,
51,0,Why does PyQt6 leave large gap between dock widgets after docking them?,
51,0,Why there is f prepended to the values,
51,0,Why are multiple expressions and statements placed on one line in Python and not individual lines?,
51,0,matplotlib.pyplot slow over SSH in terminal (fast in VS Code Remote-SSH),
51,0,Get insufficientFilePermissions error when exporting a file by GoogleDrive api,
51,0,Import Helpers.py from different directory,
51,0,Batch Update to postgreSQL table using psycopg2,
51,0,High precision timing in Python for sequencing external MIDI devices,
51,0,Computing the differential cross section using python,
51,0,How to click checkbox using selenium and python,
51,0,Django Static Files Not Loading in Production (DEBUG=False) with Gunicorn on Kubernetes,
51,0,impliedVolatility always nan in IBKR API,
51,0,Column dtype returning datetime64[ns] being compared to datetime dtype body,
51,0,Microsoft.Office.Interop.Word Documents.Open not working with .Net 8?,
51,0,SikuliX Fails to Detect Images After Resizing for resolution and DPI Scaling Adjustments,
51,0,string format a Decimal instance using an underscore as a thousands separator?,
51,0,Why is pynput not detecting key presses on my Linux machine?,
50,2,How can I automatically dismiss the &quot;Open Microsoft Teams?&quot; browser pop-up in Selenium?,
50,2,Columns are not in a row but are stacked in several rows,
50,2,Issue regarding overlap of memory allocation for separate dataclasses,
50,1,Issue with quick algo,
50,1,Multiple Python Paths,
50,1,Wrap class method with argument(s) only once,
50,1,ArUco-based XYZ coordinates of hand with Intel Realsense d415,
50,1,Document AI is extremely slow in ec2 instance and overall is slow,
50,1,How do I use the 3D adaptive threshold function in Python,
50,1,How could I self-eject my USB-Drive using the python module &#39;sub-process&#39;,
50,1,PyQt5 Styling QMenu Dropdown?,
50,1,main.py:6: SyntaxWarning: invalid decimal literal,
50,1,Why is the Spotify Get_Recommendations endpoint not working?,
50,1,Best practice when adding foreign modules to a git repo,
50,1,Plugging SciPy&#39;s Nelder-Mead result back into the function does not return reported result,
50,1,Python + Playwright browser automation,
50,1,MySQL connector doesn&#39;t take &quot;USE db&quot; in account,
50,1,about llama-2-7b model loading from huggingface even with meta liscence access,
50,1,What is the proper way to process None values in Scrapy?,
50,1,Upload file to Microsoft Fabric,
50,1,Python API for SaxonC-HE fails when creating XDM dict with string values,
50,1,Pydantic object self-validation,
50,1,Using `setattr` to decorate functions from another module,
50,1,Why isn&#39;t my react front end displaying anything?,
50,1,Why isn&#39;t this Update SQL changing the table,
50,1,How to patch global class in python correctly,
50,1,Offset in using trapezoid method for numerical integration,
50,1,Deadlock in Multiprocessing Queue,
50,1,Extracting irregular table of data from a pdf file with Python,
50,1,Aligning y-axis titles on plotly subplots,
50,1,No module named bertviz in jupyter notebook,
50,1,What can i do to make my sql based if statement run in my Jinja html template,
50,1,"Python Unittests failing in CI job, but not locally",
50,1,Append columns to a df according to the column names from the source df,
50,1,Can I customize compile options in Nuitka?,
50,1,ModuleNotFoundError issue with importing functions,
50,1,Vespa indexing anomaly on `exact`-indexed field with diacritical variants and non-latin Scripts,
50,1,How can I click on submit button on the given html in Selenium python,
50,0,Why does the mysqldb shows error in flask but not in the terminal?,
50,0,How to shift the frequency spectrum of a signal without FFT?,
50,0,Cual podr&#237;a ser un ejemplo pr&#225;ctico para describir el funcionamiento de la b&#250;squeda binaria y la b&#250;squeda l&#237;neal?,
50,0,"How to solve the question: module &#39;jaxlib.xla_extension&#39; has no attribute &#39;CpuDevice&#39;, which occurs in Balloon Learning Environment",
50,0,ConnectionResetError when sending messages to MS Teams Bot after inactivity period,
50,0,Trouble implementing a super resolution algorithm with a frequency method,
50,0,"when trying to edit child record in django inlineformset factory, I am getting error ORA-00001: unique constraint (SDESERP.UK_CODELKUP) violated",
50,0,Why does my Python multiprocessing code run slower than the single-threaded version?,
50,0,ollama.generate raises model not found error: &quot;hf.co/mradermacher/Llama-3.2-3B-Instruct-uncensored-GGUF&quot;,
50,0,Python Add Digital Signature in PDF,
50,0,Python script to loop through column to select specific cell ranges and paste special transpose on next sheet,
50,0,How to convert from Python pandas Timestamp to repeated google.protobuf.Timestamp? (Python + Google Protocol Buffers),
50,0,Need an example to understand angr state_plugins CallStack usage (angr 9.2.148),
50,0,Unable to use pyarrow optimization in AWS Glue,
50,0,Error &quot;Couldn&#39;t import Django&quot; running MS Visual Code Tutorial,
50,0,Bug related with circular imports using Flask,
50,0,Problems going between maximized and sidebar-only window,
50,0,Different number of __init__ calls for almost the same __new__ implementation,
50,0,"Tried to update conda, now I&#39;ve ruined my base env",
50,0,LoRA Adapter Loading Issue with Llama 3.1 8B - Missing Keys Warning,
50,0,"How to Programmatically Add a Required Signature Field in an Adobe PDF Using Python, R or etc",
50,0,How to Distinguish Between Product Codes and Quantities in Mixed Cells in Python?,
50,0,Teams bot doesnt seem to receive messages concurrently,
50,0,what would be the best way to launch a detached process from a python process?,
50,0,Hopsworks problem when inserting a dataframe in a Future Group,
50,0,CORS Issue between JS program and Python,
50,0,Calculating MSD of a Brownian particle using trackpy vs manually,
50,0,Creating an anaconda env from yml file that requires older anaconda version,
50,0,Cap Pricing Quantlib Python,
50,0,Why cannot build gem5 with a custom memory controller?,
50,0,Remote Debugging from Windows 10 of Airflow-DAG-Python-Code running on RHEL 8 Linux box,
50,0,Unable to read messages from kafka broker with PySpark,
50,0,Why unrecognized Argparse arg1 in bare &quot;my_script .py arg1&quot; vs &quot;python my_script.py arg1&quot;,
50,0,Llama Index Vector Store: filter a list of documents with a NOT feature,
50,0,KeyError: &#39;Adj Close&#39; when downloading stock data using yfinance in Python,
49,2,Why does my TI-84 Plus CE calculator say there&#39;s an error on line 13 when it works fine on my computer?,
49,2,How do I change a property in a Python function to be optional?,
49,2,Populating field in .ui file from QT Designer,
49,2,How to implement inheritance of default attribute values,
49,2,Graph (histogram) is blank in Plotly Dash but displays correctly in Jupyter notebook,
49,2,Selenium - Can&#39;t find an element,
49,1,Python Protocols and Instantiated Theories: Exploring unusual possibilities,
49,1,Python code coverage not working for multiprocessing inside site-packages,
49,1,How to Cache Elements to increase the Runtime Performance with lxml Pythin Library,
49,1,How do I terminate the process running a Celery task during a long-running Python function?,
49,1,streamlit-aggrid multiselect : preview values were `undefined(undefined)`,
49,1,How can I define a protocol for a class that contains a protocol field and use a dataclass implementer?,
49,1,import : The term &#39;import&#39; is not recognized as the name of a cmdlet etc,
49,1,QuerySet returns empty in django,
49,1,How do conditionally apply field constraints based on value type in pydantic v2?,
49,1,scipy.sparse: one subarray at many locations in a larger array,
49,1,How to add text to Dash Loading (dcc.Loading) component,
49,1,Subscriber issues on ESP32 running Micro-ros,
49,1,Does this leapfrog method work for the 3 body problem?,
49,1,Python amazon automation Chromedriver discovery error,
49,1,How to install and run cx_freeze,
49,1,Error when using PyInstaller to create an executable: &#39;session not created: failed to start Chrome process&#39;,
49,1,how to extract unstructured table in pdf file using python,
49,1,"Poetry Install broken, ModuleNotFoundError but Module is installed. MacOS",
49,1,I&#39;m not able to get organized data in my scraper,
49,1,How do I write out an anchor using ruamel.yaml?,
49,1,Use pop function to catch a value and then add them,
49,1,matplotlib latex text color,
49,1,"Use of Training, Validation and Test set in HuggingFace Seq2SeqTrainer",
49,1,Im trying to make a reciept maker with code and i don&#39;t know how to get my different functions to interact with each other,
49,1,Incorrect argument error when trying to enqueue a task within a firebase function,
49,1,Find element by key in json,
49,1,How to pass variable to Flask HTML form,
49,1,Changes to table with python-docx not persistent in Python 3.11,
