view_count,answer_count,Query,Intent
5726,2,How to implement a Model Context Protocol (MCP) server with SSE?,genuine
4648,0,pip install crawl4ai Error: SetuptoolsDeprecationWarning: License classifiers are deprecated,genuine
4385,2,Strange behavior in python resulting in the error: &quot;TypeError: &#39;xxx&#39; object is not callable&quot;,genuine
4004,5,What is the command to install pytorch with cuda 12.8?,manipulative
2534,1,How can I run a uv pytest tool with proper dependencies and module paths?,genuine
2102,3,The Python MCP server with STDIO transport throws an &#39;Error: SSE connection not established&#39; when attempting to connect via MCP Inspector,genuine
1793,8,import numpy failed after upgrading MacOS to 15.4,genuine
1557,1,MCP Python SDK. How to authorise a client with Bearer header with SSE?,manipulative
1340,1,TypeError in SFTTrainer Initialization: Unexpected Keyword Argument &#39;tokenizer&#39;,genuine
1338,3,How to avoid &quot;object has no attribute &#39;isAlive&#39;&quot; error while debugging in IntelliJ using Python plugin version 241.18034.62,genuine
1231,2,How to fix the transformer installation issue?,genuine
1192,1,Selenium 4.25 opens Chrome 136 with existing profile to &quot;New Tab&quot; instead of navigating with driver.get(),genuine
1175,4,I meet the Error Connecting to MCP Inspector Proxy,genuine
1131,2,How can I install a local package with UV?,genuine
991,4,I am trying to run the Google ADK but it shows command &#39;adk&#39; not found,genuine
980,2,How do I fix the ImportError Problem I&#39;m facing when running &quot;from langchain_openai import ChatOpenAI&quot; in my Google Collab?,manipulative
967,2,uv run fails with &quot;failed to spawn&quot;,genuine
902,1,IPython.display does not show any image at all but &lt;IPython.core.display.Image object&gt;,genuine
899,1,TypeError: SFTTrainer.__init__() got an unexpected keyword argument &#39;dataset_text_field&#39;,genuine
898,1,Error during SFT training of Qwen2.5-Coder-1.5B: &quot;element 0 of tensors does not require grad and does not have a grad_fn&quot;have a grad_fn`,genuine
814,0,Couldn&#39;t build wheel for pillow,genuine
776,2,How to resolve UserWarnings for deprecated USERNAME_REQUIRED and EMAIL_REQUIRED fields in Django Allauth 65.5.0,manipulative
734,1,"What explains pattern matching in Python not matching for 0.0, but matching for float()?",genuine
657,1,Unable to torch.load due to pickling/safety error,genuine
642,1,Installing `stringcase` under python `3.13.2` fails while it works on `python 3.12.9`,genuine
615,0,Ollama model keep in memory and prevent unloading between requests (keep_alive?),genuine
583,5,Removing elements based on nested dictionary values,genuine
521,1,"ImportError when importing NumPy – missing libgfortran.5.dylib on macOS (VS Code, Jupyter, Conda)",genuine
442,2,Fails new wheel version,genuine
431,1,OSError: Qwen/Qwen2.5-VL-7B-Instruct does not appear to have files named model-00002-of-00005.safetensors despite having the file locally,genuine
420,4,Multiple different attachments using Gmail API in Django,genuine
414,1,uv pip install fails for multiple packages,genuine
400,0,"tensorflow warnings, please anyone who could resolve?",genuine
379,1,"It says Could not build wheels for onnx, opencv-python which use PEP 517 and cannot be installed directly",genuine
369,4,How to find all grid points that correspond to non-reduced fractions in a square?,manipulative
361,1,How to programmatically use the result of an expression as argument to a Name node?,manipulative
357,1,How to use LLMConfig in crawl4ai?,manipulative
357,1,"Python environment error, &quot;TypeError: Choicelist and default value do not have a common dtype&quot;",genuine
342,2,How can I handle initial settings with Pydantic Settings?,genuine
341,1,FastMCP SSE port control,genuine
341,0,How do I resolve a CONFIG_NOT_AVAILABLE error in Databricks,genuine
339,4,Is it possible to turn off printing the id (hex address) globally for Python objects?,genuine
337,4,Generate 4 random numbers between -1.0 and 1.0 such their sum is 1 using python,manipulative
330,1,Llama Index AgentWorkflow WorkflowRuntimeError: Error in step &#39;run_agent_step&#39;: &#39;toolUse&#39;,genuine
317,1,How to retrieve the output of a SQL query executed with SQLExecuteQueryOperator in Airflow,manipulative
306,1,How to apply a global rate limit for all routes using SlowAPI and FastAPI?,genuine
304,1,browser-use agent stuck in loop at Step 1,genuine
303,1,What is the keyword argument shortcut reported by Pylance that requires Python 3.14?,genuine
298,0,Gunicorn / Uvicorn extremely rare 502 Errors,genuine
294,1,Error trying to install Python 3.13 alongside existing Python 3.9 installation - Windows 10,genuine
291,1,PyTorch Checkpointing Error: Recomputed Tensor Metadata Mismatch in Global Representation with Extra Sampling,genuine
289,1,Numpy 1.26.4 installation in google Collaboratory is not effective without restarting session,genuine
288,2,Updating requests from version 2.31.0 to 2.32.3 breaks my code,genuine
286,3,"InvalidDistribution: Metadata is missing required fields (Name, Version) when uploading wheel to TestPyPI",genuine
281,3,Outlook junk filtering prevent Python,genuine
268,3,How to fix this yfinance AttributeError,manipulative
268,2,Langgraph: How to retrieve and store chat history throughout the session,genuine
263,5,Why no floating point error occurs in print(0.1* 100000) vs (Decimal(0.1)*100000) due to FP representation of 0.1?,genuine
255,2,Presidio with Langchain Experimental does not detect Polish names,genuine
253,0,How to access state from LangGraph inside a tool in a react agent or OpenAI Tool Agent?,genuine
252,1,torch.distributed.elastic.multiprocessing.errors.ChildFailedError / &quot;HIP error: invalid device function&quot; following AMD AI training docs,genuine
252,1,Selenium + 2Captcha Proxy Not Working for Website,genuine
251,1,"RuntimeError: Event loop is closed - unittest, pytest",genuine
247,1,How to bypass hCaptcha when automating a website login using Selenium in Python?,genuine
246,3,"Fastest way to find all permutations of 0, 1 of width n without itertools in pure Python?",manipulative
246,0,FastAPI hosted on Lambda does not serve static content,genuine
245,1,"I updated to Spyder 6.05, and my kernel is now not loading",genuine
245,1,Filtering polars dataframe by row with boolean mask,manipulative
245,1,Post Request Not working for scraping a website,genuine
244,3,How to select element from two complex number lists to get minimum magnitude for their sum,manipulative
244,1,Optimizing LeetCode&#39;s &quot;Minimum Pair Removal to Sort Array II&quot; Solution to Prevent Time Limit Exceeded Errors,manipulative
243,0,Selenium (Chrome 136): &quot;Failed to decrypt&quot; errors with copied profile prevent use of existing login session,genuine
239,3,Python ortools CP-SAT solution for group optimization - code too clunky?,genuine
237,4,What is the fastest way to generate all n-bit gray codes using NumPy?,manipulative
237,2,How to set index url for uv like pip configurations,genuine
236,5,How to use Jupyter notebooks or IPython for development without polluting the venv?,genuine
235,1,I can&#39;t install it for the first time. Numpy 1.22.4,genuine
233,2,How to count the first N natural numbers in binary?,manipulative
232,1,Azure AI Search - Tag Scoring profile on azureopenai extra_body,genuine
230,0,How to install osgeo package for a virtual environment in python after installing a GDAL wheel?,genuine
229,3,What is the fastest way to generate alternating boolean sequences in NumPy?,manipulative
229,2,"Receiving an ERR_HTTP2_PROTOCOL_ERROR sporadically when web scraping with python selenium chromedriver, but same request works as CURL",genuine
229,0,Dahua Python SDK: P2P Connection,genuine
228,2,Debugpy Connection Refused Debug in VsCode,genuine
218,1,Selenium chrome session not created and not accessible,genuine
218,1,How to efficiently calculate the fraction (valid UTF8 byte sequence of length N)/(total N-byte sequences)?,genuine
218,1,Cant take a Screenshot using Crawl4ai,genuine
216,3,How to create tkinter Toplevel that is initially hidden (withdrawn) without flashing?,manipulative
215,1,Run Ruff in Emacs,genuine
213,1,"Is this a greedy algorithm and if so, why?",genuine
213,1,ImportError: Error importing numpy: you should not try to import numpy from its source directory,genuine
212,3,Cannot submit login form with Selenium (Python) using Headless Remote Driver,genuine
211,1,Why does this fast function with Numba JIT slow down if I JIT compile another function?,genuine
211,1,MacOS - Pty Host Disconnected VS Code,genuine
211,1,FastAPI Global Timeout Middleware Not Working for Sync Routes,genuine
210,1,Constructing custom loss function in lightgbm,genuine
209,2,How to force a string to stay a string and not be converted to a date ? - Python,manipulative
209,0,How to use uv to install a package and add it to pyproject.toml at the same time?,genuine
208,4,Documenting a script step by step with Sphinx,genuine
208,1,Python script for picking a randomly selected point that satisfies some linear inequalities,manipulative
208,1,Use a single pyproject.toml for &#39;poetry&#39; &amp; &#39;uv&#39;: dev dependencies,manipulative
208,1,YOLOv11 Model Converted to TFLite Not Producing Correct Output in TensorFlow,manipulative
207,2,How to parse a nested structure presented as a flat list?,manipulative
206,6,"How to skip, if starts with, but match other strings",manipulative
206,1,Cloudflare Blocking Playwright Script for Glassdoor Web Scraping,genuine
205,2,How to exclude thinking steps when streaming from `google/gemini-2.5-flash-preview:thinking` via OpenRouter and OpenAI library?,genuine
204,1,Fast calculation of Nth generalized Fibonacci number of order K?,genuine
203,1,Weird trough in histogram of hypotenuse calculated using hypot(),manipulative
202,3,Convert multiple-page PDF files to PNG quickly,manipulative
202,2,Type hint return type of abstract method to be any instance of parent class,genuine
201,3,Time limit exceeded on Leetcode 128 even for optimal time complexity,manipulative
200,1,Langgraph: Getting ValueError: Found edge ending at unknown node `&lt;function chatbot at 0x..&gt;` while compiling,genuine
199,5,Expand Columns of Structs to Rows in polars,genuine
199,2,How to send Slack api request to websocket without Bolt or other SDK?,manipulative
197,2,How to prevent ruff from formatting arguments of a function into separate lines?,genuine
197,1,Extracting AI Responses from a Multi-Agent Graph using LangGraph,manipulative
196,2,Pip python Cannot install module spaCy,genuine
195,0,Numpy IO seems to have an 2GB overhead in StorNex (cvfs) File System,genuine
194,2,"I have installed selenium 4.31, but Selenium Manager is not picking up the chrome driver",genuine
193,0,"In a uv-created venv, the VS Code Integrated Debugger is not activating when clicking &quot;Debug Test&quot; from VS Code Integrated Testing",genuine
192,2,Is &quot;type&quot; a keyword,genuine
191,2,How to create a NumPy structured array with different field values using full_like?,manipulative
190,2,What is a faster way to find all unique partitions of an integer and their weights?,manipulative
189,2,Is it possible to use the closed-form of Fibonacci series to generate the Nth Fibonacci number exactly and efficiently?,manipulative
188,2,"How to reliably compress/reduce SVG file size to a specific target limit (e.g., under 10KB)?",genuine
188,1,MCP Server is giving &quot;The selected tool does not have a callable &#39;function&#39;&quot; when using via autogen,genuine
188,1,"&#39;uv sync&#39; to install python package, but tell me complie command not find?",genuine
188,1,Create all possible outcomes from numpy matrices that show disjoints and subsets,manipulative
188,1,how to recover from error &quot;Cannot mix incompatible Qt library (6.8.3) with this library (6.8.2)&quot;,genuine
187,4,How to reference class static data in decorator method,manipulative
187,1,Run EXE software using App in Windows IIS,genuine
186,4,Fastest way to find indices of highest value in a matrix iteratively and exclusionarily,manipulative
186,2,What can I do if installing Python bindings to ta-lib fails？,genuine
186,2,how can I fix the error? TypeError: Lock.__init__() got an unexpected keyword argument &#39;loop&#39;,manipulative
185,2,How to get specified number of decimal places of any fraction?,genuine
185,1,Issues with Recursive Digraph Construction and Missing Loops in Python Code,manipulative
185,1,Trouble installing PyNvVideoCodec package on python 3.11,genuine
185,1,Length of features is not equal to the length of SHAP Values,manipulative
185,1,Trouble importing mediapipe (Ubuntu 24.04.2 LTS),genuine
185,1,"Error from Pycharm: Expected type &#39;SupportsIndex | slice&#39;, got &#39;str&#39; instead",genuine
184,3,Python Azure Function doesn&#39;t show functions after importing packages,genuine
183,1,How can I store ids in Python without paying the 28-byte-per-int price?,genuine
183,1,Fastest way to search 5k rows inside of 100m row pair-wise dataframe,manipulative
183,0,Python NiceGUI / FastAPI App Insights Integration,manipulative
182,7,Remove duplicates based on criteria from one column while merging data from different column,manipulative
182,1,DIfference in variable values in jax non-jit runtime and jit transformed runtime,genuine
182,1,Playwright Chromium Executable Missing or Version Mismatch in Python (VSCode),genuine
180,2,How to pass an argument to a &#39;dependencies&#39; function in FastAPI?,manipulative
180,1,Error installing module in Pycharm: &quot;ERROR: Could not install packages due to an OSError: Failed to parse: http://your_proxy_server:port&quot;,genuine
179,0,Diagram of road intersection flows (Sankey or other),genuine
178,3,Confused on a simple SAT problem using Python z3,manipulative
178,2,Pyodide: My pygame code that works in pyodide have no error but no result,manipulative
178,2,Cumulative Elementwise Sum by Python Polars,manipulative
178,1,Correct type annotations for generator function that yields slices of the given sequence?,manipulative
178,1,Why is Poetry complaining that `name` isn&#39;t set in pyproject.toml?,genuine
178,0,Google Gemini not calling the tools,genuine
177,1,Properly typing a Python decorator with ParamSpec and Concatenate that allows for arbitrary argument positioning?,manipulative
176,3,Python: columns must be same length as key when splitting a column,manipulative
176,2,Is it OK to not use the value of the index &#39;i&#39; inside a for loop?,genuine
175,4,How to generate a PDF with a grid of images per page?,manipulative
175,1,How can I correctly implement AES-256-ECB from scratch in Python?,manipulative
175,0,Issues Running Code Chunks in Quarto on Positron,genuine
174,1,How to set an end time for a LiveKit room and send a warning message 1 minute before disconnecting using Python?,genuine
174,1,uv Python package manager. What is the base environment when doing &#39;uv venv&#39;. Does it include dependencies in project .toml?,genuine
173,2,How to build a nested adjacency list from an adjacency list and a hierarchy?,manipulative
173,1,Efficient and readable way to get N-dimensional index array in C-order using NumPy,manipulative
172,1,Docker image ubuntu/python:3.12-24.04_stable exit code:1 with /bin/sh,genuine
171,2,How to efficiently process a large CSV file with pandas when memory is limited?,genuine
171,2,Renaming columns names in Polars,manipulative
171,2,My modal doesn&#39;t appear after an action in Streamlit,genuine
171,1,Gemini 2.0 experimental image generation in django,manipulative
170,4,Explode nested JSON to Dataframe,manipulative
170,3,2 Laser beams number of intersections in a mirror problem,manipulative
170,1,Can SHAP be used to calculate Shapley values for traditional coalitional game theory applications?,genuine
168,3,How to stop this while loop after it has run through a full array,manipulative
167,1,How to get the key and values from a dictionary to display them on a Django page?,manipulative
166,2,Algorithm for detecting full loop when iterating over a list,manipulative
166,2,"In strawberry, how do I make a strawberry.input non-nullable but optional in an update mutation",manipulative
166,1,Intercepting and redirecting calls of a nested class structure in python,manipulative
166,0,numpy matmul raises divide by zero warning,manipulative
165,2,Triggering next node in langgraph,manipulative
164,2,How to automatically update extra column in sqlalchemy association table?,manipulative
164,2,Logging operation results in pandas (equivalent of STATA/tidylog),manipulative
164,1,Find corresponding date of max value in a rolling window of each partition,manipulative
164,1,unsloth save_pretrained_merged function issue,manipulative
163,1,When is typing.cast required?,genuine
163,1,How to change the list[str] annotation so that it accepts list[LiteralString] too?,manipulative
163,1,How to specify a nightly Pytorch version in environment.yml,manipulative
162,2,"RuntimeError: Expected all tensors to be on the same device, but found at least two devices, cuda:1 and cuda:0! during training on multi-GPU setup",genuine
162,2,How Can I Type a Method That Accepts Any Subclass of a Base Class?,manipulative
162,1,Python streamlit realtime speech-to-text with azure SDK,genuine
161,4,"Replace values in series with first regex group if found, if not leave nan",manipulative
161,3,Cropping DICOM image fragment in Python,manipulative
160,1,How is np.repeat so fast?,genuine
160,1,How to validate search terms when using embedding to look for objects in images,genuine
160,1,How can I run DeepFace in a docker container on a mac?,genuine
159,2,Connect to my SQL database on Python but I can connect with same login credentials on SSMS,genuine
159,2,uv&#39;s [project.scripts] won&#39;t activate the environment in venv,genuine
159,2,Why is the continued fraction expansion of arctangent combined with half-angle formula not working with Machin-like series?,genuine
159,1,How to pass a byte buffer from python to C++,manipulative
159,1,Python logging when forking processes,
159,1,RSA/ECB/PKCS1PADDING encryption port from java to Python,
159,0,Issues with Tensorflow and Tensorflow-io while training a CNN on Colab,
158,2,Group by and apply multiple custom functions on multiple columns in python pandas,
158,1,How to simplify the generation process of these boolean images?,
158,0,Python mouse movement,
158,0,FAISS.from_texts() occur ValueError: input not a numpy array,
157,1,How to make my AWS Bedrock RAG AI Assistant ask which product the user is asking about,
157,0,Download Confluence Pages as PDFs via API using Python,
156,4,How to get the output values ​of a apply,
156,3,Python time.strftime gives different results for %Z and %z,
156,1,Using typing.assert_never() with abstract base classes to ensure full coverage,
156,1,Getting Infeasibility while solving constraint programming for shelf space allocation problem,
155,2,Python - How to check for missing values not represented by NaN?,
155,0,"Using GPIO pin and neopixel Raspberry Pi 5, Failed to open PIO device (error -22)",
154,5,Assign a number for every matching value in list,
154,2,Counting number of null values in group - why built in method doesn&#39;t work?,
154,2,Custom colormap in matplotlib using LinearSegmentedColormap not working as expected,
154,2,HTTP POST from Apps Script to Google Cloud Run Function,
154,1,"Playwright install fails on Ubuntu 24.04 due to missing system dependencies, even after installing recommended packages",
154,1,How to add a shutdown event in FastAPI using lifespan in middleware?,
154,1,Why does mlx.core.sqrt() crash on my MacBook Air M2 when applied to a complex argument?,
154,1,&quot;The system cannot find the path specified…..\AppData\Local\Programs\Python\Python313\python.exe] was unexpected at this time&quot; pyspark in command line,
154,0,New generic type hints (python 3.12+) for numpy,
154,0,How to use Podman with PyCharm on Windows?,
153,2,Pyside6-designer: export Python code of custom (promoted) widget,
153,1,Not able to connect to Selenium Chrome service,
153,1,Pydantic CLIApp/CLISubCommand with Env Vars,
153,1,Agno (Phidata) reading PDF as knowledge base failed,
153,0,Using python decorators associated with an instance level object,
152,2,What should be the best practice for handling migration files in Django when multiple developers are involved?,
152,2,"Why am I still getting, &quot;You didn&#39;t give me a valid value, please try again! after entering the correct color?",
152,2,"For multi-index columns in pandas dataframe, how can I group index of a particular level value for visualization in Python?",
152,2,Shift+enter inserts extra indents,
152,1,Expanding numpy based code that detect the frequency of the consecutive number to work on multidimensional array instead of 1D array,
152,0,"Why is my LiveKit-based multimodal agent speaking twice in the room, even though transcript looks correct?",
151,3,Faster moving median in numpy,
151,1,Is it possible to limit attributes in a Python sub class using __slots__?,
151,1,Prevent conda from using the defaults channel in `conda update conda`,
151,1,Do Python version issues with TTA lead to fasttransform vs. fastcore bugs in Python &gt;= 3.10?,
150,2,how to gracefully ignore non-matching keyword matching arguments in python dataclass,
150,1,Aiogram message formatting,
150,0,How do I use DeepSeek R1 Distill through HuggingFace Inference API?,
149,5,"Filter a dict, keeping only certain keys, and applying defaults where they are missing",
149,2,How can I optimize Python code for faster execution?,
149,2,Playwright&#39;s set_input_files() function doesn&#39;t work properly in python,
149,1,How can I efficiently set up Python virtual environments for 200+ student submissions?,
149,1,DeprecationWarning with groupby().apply(): How to properly exclude grouping column in pandas 2.2+,
148,1,How to let a tool return a picture when using langgraph/langchain?,
148,1,Image matching fails with low confidence using pyautogui and OpenCV,
148,1,What is best way to store small amount of data in BE (literally 1 line)?,
148,1,"Using Python&#39;s Selenium, a page displays blank although it&#39;s displayed correctly using normal browsing",
148,1,Why can I read a file with pandas but not with polars?,
147,2,What is the difference between numpy.atan and numpy.arctan?,
147,2,Arrange consecutive zeros in panda by specific rule,
147,1,SaltStack custom state: How to download file from &quot;salt:&quot; URI,
147,0,LangChain AgentExecutor invoke() doesn&#39;t return multiline output,
146,5,How Do We Use numpy to Create a Matrix of all permutations of three separate value ranges?,
146,5,What is the best way to get the last non zero value in a window of N rows?,
146,3,How to make Vim&#39;s :python3 command use a virtual environment?,
146,1,How to accurately segment overlapping rice grains in an image using OpenCV,
146,1,Why do I get &quot;ModuleNotFoundError: No module named &#39;pandas&#39; &quot; in Jupyter when I already installed pandas before setting up the .venv?,
146,1,Adding hours to a polars time column in python,
145,2,&#39;numpy.ndarray&#39; object has no attribute &#39;groupby&#39;,
145,1,How do I use the python support in DigitalMicrograph to save a color image as PNG file,
145,1,"UserWarning: FigureCanvasAgg is non-interactive, and thus cannot be shown",
145,1,Why does Presidio with spacy nlp engine not recognize organizations and PESEL while spaCy does?,
145,1,PlainXComArg not resolving before being passed to Operator,
145,0,Improve This APNG Webpage Recorder to Capture Smooth 30+ FPS Video,
145,0,Playwright Persistent Context with msedge.exe Fails in PyInstaller-Compiled Executable (TargetClosedError),
144,6,How can I divide a list of electrical loads into 3 groups with near-equal total sum using Python?,
144,4,replace CRLF characters in middle of row for unquoted csv file using python,
144,1,ImportError: cannot import name &#39;executor&#39; from &#39;aiogram.utils&#39;,
144,1,Permutations problem on python I can&#39;t understand where I am wrong,
144,0,Reportlab cannot open resource when using Minio (S3) pre-signed link,
143,3,Sending request from React to FastAPI causes a CORS policy error,
143,2,How to use oxylabs proxy in seleniumbase?,
143,1,"First Attempt at Downloading a Google Sheet using Python Selenium, Getting a 401 Authentication Error",
143,1,General way to define JAX functions with non-differentiable arguments,
142,4,&quot;a&quot; == 97 expression is returning always False,
142,3,Converting Python socket server to Asyncio,
142,1,Why doesn&#39;t multiprocessing.Process.start() in Python guarantee that the process has started?,
142,1,Why is python thinking my folder is a module?,
141,4,Why can&#39;t I use nested for loops to change values in matrices?,
141,4,How to compare objects based on their superclass,
141,2,What happens to the asyncio event loop when multiple CPU-bound tasks run concurrently in a ThreadPoolExecutor given Python’s GIL?,
141,0,How to Build a Robust Camera Calibration Function Using OpenCV with findCirclesGrid and SimpleBlobDetector?,
140,3,how to generate random probability arrays with pre specified mean,
140,3,Why my function that converts a string of digits to a list of bytes doesn&#39;t work?,
140,3,Trying to delete overlapping nested lists in Python,
140,2,How do I unittest an HTML page that contains an embedded dynamic image?,
140,2,GitHub Action - Deploy Python to Azure Function - import azure.identity not working,
140,1,How can I setup the virtual grid?,
139,2,Pyinstaller - rename _internal folder,
139,1,Simple typer script gives TypeError,
139,1,Python overload doesn&#39;t match `Any` case,
139,1,How to create custom columns when creating embeddings using llamaindex in postgres (with pgvector extension),
139,0,How to Link Zoom (X-Axis) of Two Separate Plotly Plots in Streamlit?,
